question1,question2,label,category
糖尿病人能过性生活吗？,男性有糖尿病能过性生活吗？,1,diabetes
这样算是孕期糖尿病吗？,我是妊娠期糖尿病，我现在又怀孕了，怎么,0,diabetes
口jiao会感染艾滋病吗,无套口交会传染艾滋病吗,1,aids
艾滋病会不会通过蚊子传播,脚上有个出血的伤口今天被蚊子正好咬那了，不会得艾滋病吧，担心,1,aids
手淫自慰是否会感染艾滋病,手淫会感染上艾滋病么,1,aids
得糖尿病想全面检查检查下要住院吗,糖尿病20年要怎样治疗呢？,0,diabetes
糖尿病人日常生活中应该注意什么问题？,糖尿病人打了胰岛素还需要忌讳生活方式吗,1,diabetes
唾液和尿液就可以检测艾滋病病毒吗,艾滋病唾液测试纸可以检测准确吗,0,aids
乳腺癌转移到肺部怎么办,乳腺癌转移肺部如何治疗,1,breast_cancer
高血压的人上火了吃什么补品好？,我父亲高血压10了最近很长段时间睡眠不好怎么办,0,hypertension
妊娠糖尿病怎么治疗,糖尿病患者怎样增肥,0,diabetes
经常吃面条的人.是否容易得糖尿病.,我今年17岁，有可能得糖尿病吗？,0,diabetes
糖尿病患者能吃香蕉吗,吃什么中药可以治疗糖尿病,0,diabetes
高血压患者可以喝蜂蜜水么,请问高血压用玉米穗上的须熬水当茶喝可以治愈,0,hypertension
糖尿病肾病的营养治疗,糖尿病肾病怎么治好,1,diabetes
早上空腹，葡萄糖是12.01不吃药能控制血糖吗,糖尿病肾病患者可以吃什么水果？,0,diabetes
艾滋病皮疹痛吗，痒吗有什么症状,腋窝痒是艾滋病的症状,0,aids
糖尿病尿液会引来很多蚂蚁吗,嘴里发甜是否糖尿病吗？,0,diabetes
糖尿病人能常吃红枣吗,水果酵素糖尿病能喝吗,0,diabetes
艾滋病会传染吗,跟艾滋病人性交一定会传染吗跟艾滋病人性交一定会传染吗,0,aids
一型糖尿病患者能吃丝瓜、韭菜和虾吗？主食最好吃什么？,糖尿病人主食吃什么,1,diabetes
糖尿病能吃海鲜吗,糖尿病人可以吃海鲜吗,1,diabetes
乙肝表面抗原弱阳性怎么回事,乙肝表面抗原（金标初筛）阳性十，是什么,1,hepatitis
尿糖高是怎么回事?参考值范围是0到5.5，值体检值是14.,糖尿病是吃药好还是打胰岛素好？,0,diabetes
手淫自慰是否会感染艾滋病,手淫时洗澡会不会得艾滋,1,aids
乳腺癌骨转移全身疼痛怎么办,乳腺癌放疗部位疼痛怎么办？,0,breast_cancer
治疗糖尿病有偏方吗,糖尿病并发阳痿的偏方,0,diabetes
乳头内陷会不会得乳腺癌,乳头内陷会得乳腺癌吗？,1,breast_cancer
糖尿病能不能吃蛋白粉,糖尿病能吃钙片吗应注意哪些,1,diabetes
有高血压的人在饮食方面要注意什么？,高血压的最有效食疗是什么,1,hypertension
乳腺癌晚期有什么症状,乳腺癌晚期症状？？,1,breast_cancer
高血压药影响性功能吗,高血压药和性功能的关系,1,hypertension
如何用尿测血糖,尿糖病是糖尿病吗？,0,diabetes
乳腺癌的早期中期晚期如何区分,如何知道乳腺癌是早期还是中期？,0,breast_cancer
治疗乳腺癌切除卵巢有多大作用,乳腺癌病人一定要切除卵巢吗,0,breast_cancer
乙肝疫苗在什么情况打,乙肝最有效的治疗方法,0,hepatitis
中成药类治疗糖尿病,吃中药能治好糖尿病吗,1,diabetes
什么情况下需要使用胰岛素？,孕妇糖尿病的标准值,0,diabetes
糖尿病的减肥方法,糖尿病足属于丧失劳动能力吗？,0,diabetes
血糖多少妊娠糖尿病,妊娠糖尿病血糖多高,1,diabetes
产检糖尿病筛查多少钱,糖尿病是否可以打狂犬疫苗？,0,diabetes
这种情况有可能会感染上艾滋病吗,发生这种情况会感染艾滋病吗,1,aids
糖尿病尿蛋白高吃什么药,糖尿病，检查出尿蛋白88，需吃什么药,1,diabetes
高血压肾萎缩怎么办,我妈妈今年45岁了，患有由高血压引起的肾萎缩，请问该如何治疗,1,hypertension
薏米红豆粥糖尿病人人可以喝吗，刚发现，,糖尿病喝酸奶好吗？,0,diabetes
妊娠糖尿病人可吃鸡肉吗,糖尿病患者可以吃西洋鸭吗,0,diabetes
怎样预防糖尿病并发症,如何预防糖尿病才有效,0,diabetes
原发性高血压有办法治疗吗？,原发性高血压怎样治疗,1,hypertension
糖尿病药物控制血糖居高不下，该怎么办？,血糖老是控制问题，急~！帮忙看看啊~~~,0,diabetes
乙肝转氨酶升高要怎么治疗,乙肝转氨酶总升高怎么办,1,hepatitis
这样做会不会得艾滋病,我这样会不会得艾滋病啊,1,aids
尖锐湿疣会引发艾滋病吗,有艾滋病可以治疗尖锐湿疣吗,0,aids
乳腺癌晚期转移会出现什么症状呢,乳腺癌的肺转移到底有什么症状？,0,breast_cancer
高血压可以生小孩吗,高血压患者是否可以生小孩要注意哪些问题,1,hypertension
乙肝能否治愈它通过什么途径传播,乙肝传播途径以及传染源,1,hepatitis
你好。血糖高初比例容易得糖尿病嘛,吃汤饭容易得糖尿病吗,1,diabetes
乙肝病毒DNA阴性要治疗吗,乙肝病毒DNA测定726E07要注意什么,0,hepatitis
因为不知道乙肝小三阳病人是不可以吃羊肉,乙肝患者可以吃羊肉吗,1,hepatitis
乳腺癌化疗后白细胞偏低怎么办,乳腺癌放化疗后半年白细胞低怎么办,0,breast_cancer
乳腺癌肿瘤标志物的特点,乳腺癌肿瘤有良性的吗？,0,breast_cancer
糖尿病患者牙龈萎缩症状是什么？吃什么药？,医生你好！我想请问糖尿病并发的牙龈炎症怎么办？吃什么药？饮食方面注意什么？,1,diabetes
你好我血压是6090怎样能提高血压,吃什么药可以控制,0,hypertension
糖尿病人最健康的食谱是什么？,糖尿病饮食就是不吃甜的吗?,1,diabetes
糖尿病吃饭能喝汤吗,糖尿病能吃粉汤吗,1,diabetes
带套嫖娼会不会感染艾滋病毒,带套性交一次会感染艾滋病吗,1,aids
血糖空腹和餐后降不下来,能否治疗糖尿病引起的白内障,0,diabetes
低血糖会变成糖尿病吗？检查血糖正常,糖尿病肾病可不可以吃蛋白粉,0,diabetes
糖尿病人可以食红参吗,糖尿病的早期症状是怎么样的,0,diabetes
怎样有效治疗乙肝转氨酶升高,乙肝患者转氨酶升高能怀孕吗,0,hepatitis
糖尿病人会传染吗,糖尿病会传染吗？？？,1,diabetes
什么样的人得糖尿病的概率高,长期吃什么东西会得糖尿病,0,diabetes
艾滋病窗口期会出现腹泻症状吗,我经常腹泻会是艾滋病吗,0,aids
乳腺癌骨转移治疗方法,乳腺癌晚期骨转移如何治疗,0,breast_cancer
乳腺癌晚期有什么症状,浸润性乳腺癌晚期症状,1,breast_cancer
乳腺癌的分期是怎么回事,乳腺癌是怎么回事？病因？,0,breast_cancer
糖尿病可以喝鲜人参枸杞酒吗,糖尿病人可不可以吃蜂蜜？要有什么注意？,0,diabetes
得了艾滋病的人一般能活多久,艾滋病患者一般可以活多久才死亡，怎样才知,1,aids
乳房有硬块是不是乳腺癌,最近我触摸我乳房得时摸到我两边得乳房里都有硬块是不是乳腺癌啊,1,breast_cancer
乳腺癌严重吗,乳腺癌pt2n2m0iiia期严重吗？,1,breast_cancer
糖尿病引起的身上痒怎样解决,妊娠糖尿病可以吃红米吗,0,diabetes
男男同性恋性行为会感染艾滋病吗,边缘性行为会感染艾滋吗,0,aids
我老妈有糖尿病又有脂肪肝吃什么,糖尿病性脂肪肝在饮食上应注意什么,1,diabetes
我就是想问低血糖会不会得糖尿病,低血糖会不会得糖尿病,1,diabetes
男人会得乳腺癌吗,没有结婚会得乳腺癌吗？,0,breast_cancer
乙肝抗体是怎么回事啊,我的乙肝面抗体，e抗体怎么回事,1,hepatitis
没有注射乙肝疫苗没有不洁行为为什么产生抗体,注射了乙肝疫苗为什么手臂很胀痛,0,hepatitis
怀孕37周了，发现得了糖尿病，该怎么办？,怀孕19周查出糖尿病怎么办,1,diabetes
治疗乙肝大三阳是中药还是西药效果好呀,乙肝大三阳能治疗好吗目前可以治疗好吗,1,hepatitis
跟乙肝病人一起生活平时应该注意什么,乙肝病毒表面抗原，阳性是什么原因,0,hepatitis
舌吻会传染艾滋病吗,朋友和我主动舌吻会不会感染艾滋,1,aids
有乙肝大三阳可以办食品健康证吗,肝功能正常，有乙肝小三阳可以办健康证吗,1,hepatitis
高血压性心脏病是什么意思,我失眠又有高血压地西泮片和降压灵能一起,0,hypertension
低血压，高血压都高怎么办？,高血压112低血压53该怎么办。需要多,0,hypertension
牙齿松动该如何治疗？注‘糖尿病患者！,糖尿病牙齿松动有什么药好吃,1,diabetes
小时候得过黄疸肝炎，我会不会是乙肝携带者,黄疸是乙肝并发症吗,0,hepatitis
糖尿病人能吃绿豆汤吗,氨溴索口服液糖尿病人能喝吗,0,diabetes
艾滋病主要通过什么途径传播,没有三种传播途径，艾滋病的症状怎么会这么明显,0,aids
如何形成的乳腺癌,如何形成的乳腺癌也？,1,breast_cancer
糖尿病看好一共需要多少钱,孕妇有糖尿病有什么症状表现,0,diabetes
糖尿病酮体高怎样治疗,糖尿病不吃饭怎么办,0,diabetes
糖尿病血糖值多少算低血糖,糖尿病患者低血糖的标准,1,diabetes
纤维瘤会导致乳腺癌吗,纤维瘤会不会导致乳腺癌,1,breast_cancer
糖尿病的中医辨证,糖尿病中医能治愈吗,0,diabetes
糖尿病患者低血糖的标准,血糖高到什么指数算是达到糖尿病的标准？,0,diabetes
乙肝病人能和普通人一起吃饭吗,跟有乙肝的朋友在一起吃饭两个多月会被传染吗,0,hepatitis
乳腺癌手术后还能活多久,被医院查出有乳腺癌还能活多久？,0,breast_cancer
一个月前诊断高血压，开的拜新同，请问是饭前服用好？还是饭后服用好？谢谢。,高血压药是饭前吃好还是饭后吃好,1,hypertension
丰胸会引发乳腺癌吗,经常用丰胸产品会得乳腺癌吗,1,breast_cancer
糖尿病该怎么调理,糖尿病人出现黑指甲怎么办,0,diabetes
糖尿病人容易口渴吗,糖尿病人怎么测血糖,0,diabetes
糖尿病和尿毒症区别,高血糖与糖尿病有什么区别,0,diabetes
糖尿病人能吃煮鸡蛋吗,糖尿病一定要运动吗,0,diabetes
糖尿病会导致不能行走吗,糖尿病会导致行走困难吗,1,diabetes
糖尿病血糖如何控制,糖尿病人血糖应该控制到多少？,1,diabetes
妊娠期糖尿病什么症状,孕期糖尿病验尿有什么作用,0,diabetes
高血压遗传没有吃过药现在是血压156,高血压能拔牙吗,0,hypertension
请问高血压能喝牛奶吗,高血压可以喝酸奶吃猕猴桃或者泡柠檬水喝吗,1,hypertension
孕妇有糖尿病怎么办啊,妊娠糖尿病如何治疗,1,diabetes
乳腺增生和乳腺癌有什么区别,如何鉴别乳腺增生和乳腺癌,1,breast_cancer
高血压不吃药可以吗？,同时患有心脏病、高血压、糖尿病的人吃什么干果比较好想杏仁、巴旦木、榛子之类的可以吃吗？,0,hypertension
糖尿病低血糖原因,餐后血糖低于空腹血糖是为什么？,0,diabetes
老年人糖尿病性心脏病吃什么好,糖尿病人能吃什么坚果,0,diabetes
请问糖尿病人能否吃西洋参,中医药怎样治疗糖尿病,1,diabetes
糖尿病吃哪种药副作用少,II型糖尿病吃什么样的药副作用小？效果好点、,1,diabetes
乳腺增生可以根治吗,乳腺增生能治好吗？,1,breast_cancer
糖尿病人吃苦瓜的好处,糖尿病用苦瓜泡水能起作用吗？,0,diabetes
乳腺癌晚期骨转移严重吗,乳腺癌骨转移如何治,0,breast_cancer
低血压和高血压相差大是咋回事,我高血压150，低血压只有72，高低差距大，是否可服药？,1,hypertension
你好，请问空腹血糖7.64算糖尿病吗？,你好，我最近体检血糖为6.40是糖尿病吗,1,diabetes
糖尿病人卧床引起肺部感染有无生命危险,糖尿病肺部感染怎么办？,1,diabetes
乙肝DNA阴性是病毒数为零吗,乙肝病毒复制快慢多少要做乙肝DNA吗几,0,hepatitis
注射乙肝疫苗是否还会感染,打完疫苗接触乙肝会被传染吗,1,hepatitis
糖尿病便秘怎么治疗,尿酸高与糖尿病有关吗,0,diabetes
糖尿病患者能否用壮阳药,口苦，口干是否是糖尿病？,0,diabetes
进口乙肝疫苗和国产的可以混打吗,乙肝疫苗国产的和进口的差别大么,1,hepatitis
我是2型糖尿病我想问一下做手术能治吗,足道泡脚治疗糖尿病吗,0,diabetes
乳腺癌患者是否有必要切除卵巢,乳腺癌术后要切除卵巢吗？,1,breast_cancer
糖耐量受损，家族有糖尿病史，请问能怀孕吗,糖尿病吃什么保健品最好？,0,diabetes
二型糖尿病要浮肿，应该怎么办？,糖尿病的足部水肿怎么办,1,diabetes
艾滋病是什么样的情况,什么样的症状才显示是艾滋病啊,1,aids
手淫自慰是否会感染艾滋病,被无套口交手淫会不会得艾滋病,0,aids
慢性乙肝和牙龈流血存在一定关系吗,慢性乙肝会引起牙龈出血吗,1,hepatitis
糖尿病口臭怎么治疗,糖尿病人咳嗽有什么土办法,0,diabetes
吃太多的糖会得糖尿病吗?,吃糖多会得糖尿病么,1,diabetes
治疗糖尿病按摩的穴位,糖尿病按摩什么穴位,1,diabetes
糖尿病老人便秘怎么办,糖尿病有什么新突破吗,0,diabetes
早期乳腺癌会有哪些不适,早期乳腺癌都有什么症状,1,breast_cancer
治疗糖尿病有特效药吗,速效胰岛素哪个厂家好?,0,diabetes
糖尿病人肺部感染该如何治疗？,糖尿病，肺部感染的手术应该如何处理？,1,diabetes
乳腺癌骨转移晚期如何用药,乳腺癌骨转移的最好办法,0,breast_cancer
糖尿病吃药好还是打胰岛素好,糖耐量多少是糖尿病,0,diabetes
口交传染艾滋病的可能性大吗,带套口交能传染艾滋病吗,0,aids
艾滋病跟尖锐湿疣、梅毒有联系么,一下，尖锐湿疣是否是艾滋病这病不,0,aids
高血压后遗症偏瘫如何恢复,妊高症后遗症高血压如何治疗,1,hypertension
打了乙肝疫苗，没产生抗体是什么原因,打了乙肝疫苗，没有产生抗体怎么办,1,hepatitis
糖尿病补血食疗法,请问大夫。有糖尿病的人吃什么补血能好一些。,1,diabetes
艾滋病是怎么产生的,艾滋病的病毒是怎么产生的,1,aids
高血压有哪些症状？高血压有哪些症状？,慢性乙肝患者，血压100150，吃什么降压药好？,0,hypertension
妊娠期糖尿病可以吃地瓜吗,糖尿病患者如何饮食？,0,diabetes
为什么有人会的糖尿病,我患糖尿病后，一直头晕，是怎么回事？,0,diabetes
糖尿病如何处理伤口,甘精胰岛素的价格,0,diabetes
熬夜对糖尿病有影响吗,糖尿病人腿虚心慌怎么回事,0,diabetes
患有脑梗塞糖尿病3个月现全身无力吃什么药,糖尿病人得了左侧小脑梗塞能康复吗？,1,diabetes
没有糖尿病突然血糖升高是怎么回事,酮体,0,diabetes
孕妇检查糖耐量前要注意什么,检查妊娠糖尿病可以在村里吗,0,diabetes
乳腺癌早期有可能有哪些症状,乳腺癌通常在早期有哪些症状啊？,1,breast_cancer
乙肝病毒携带者怀孕如何阻断母婴传播,乙肝病毒携带者能不能吃补药或枸杞或牛鞭,0,hepatitis
糖尿病人肚子痛是什么原因,糖耐量的定义,0,diabetes
乙肝转氨酶轻度升高该怎么办呢转氨酶轻,乙肝转氨酶升高怎么治疗呢,1,hepatitis
治疗糖尿病的偏方有哪些呢,治疗糖尿病最好方法，有哪些,1,diabetes
婚检查出是乙肝活动期会不让领证吗,体检查出乙肝病毒携带者已结婚该咋办,1,hepatitis
请问是否是得了糖尿病？,是否确认得了糖尿病？,1,diabetes
乙肝小三阳可以转阴么,乙肝第五项能转阴吗,0,hepatitis
乳腺癌转移到肺部怎么办,乳腺癌肺部转移后怎么办,1,breast_cancer
急性糖尿病是尿毒症的前兆吗？,糖尿病跟尿毒症有何区别？,1,diabetes
糖尿病人对孕期的危害,怀孕有糖尿病会有什么影响,0,diabetes
有艾滋病可以做爱吗,第一次做爱的艾滋病的几率有多大,0,aids
女方糖尿病可以怀孕吗,二型糖尿病能否怀孕？,1,diabetes
糖尿病人出现低血糖想象要怎么办,妊娠期糖尿病诊断标准,0,diabetes
糖尿病会不会是胰腺癌,什么是妊辰期糖尿病,0,diabetes
糖尿病眼睛是什么症状,糖尿病最后的症状是什么,0,diabetes
乳腺癌化疗以后升白细胞的药物有哪些,做乳腺癌化疗白细胞低，请问可以开什么药,1,breast_cancer
什么是艾滋病的窗口期,艾滋病窗口期是什么意思,1,aids
艾滋病人的口水会不会传染,到底多少唾液才能传播艾滋病如果他有艾滋病口水飞到我伤口会不会传播艾滋,0,aids
更年期初期引起高血压怎样治疗,更年期高血压怎么治血压晚上高，高压150左右，低压95左右，白天在13092左右,1,hypertension
乳腺癌骨转移有什么特效药,乳腺癌晚期特效药有什么,0,breast_cancer
怎样打乙肝疫苗,乙肝疫苗最多能打几次,1,hepatitis
乙肝五项检查多少钱啊,延安市哪里可以打乙肝疫苗,0,hepatitis
被艾滋病患者指甲抓破抓伤会感染艾滋病吗,什么样的伤口会被感染艾滋病,0,aids
高血压可以饮少量葡萄酒,血压多高算是高血压，应该怎么办？,0,hypertension
被艾滋病患者指甲抓破抓伤会感染艾滋病吗,有被艾滋病毒者，抓破过手会被感染吗,1,aids
老年女性糖尿病人出现尿失禁该怎么办,糖尿病多年，如今大小便失禁.该如何治疗,1,diabetes
捡验乙肝表面抗体需要空腹吗吃了避孕,乙肝患者检查乙肝仅需空腹就完事了吗,1,hepatitis
你好请问你介绍的中药治疗糖尿病那么每一,糖尿病看中医行吗,0,diabetes
乳腺癌晚期转移会出现什么症状呢,乳腺癌早期会出现什么症状,0,breast_cancer
高血压喝些什么茶好点？,高血压的患者能喝什么茶什么茶比较适合还是不能喝浓的茶,1,hypertension
空腹葡萄糖5.3是不是糖尿病,尿检葡萄糖+-是糖尿病的前兆吗血糖化验正常,1,diabetes
尿糖++，不会得妊娠期糖尿病了吧！,高血压合并糖尿病能怀孕生小孩吗,0,diabetes
糖尿病呕吐头晕怎么办,糖尿病有最佳治疗方法吗,0,diabetes
皮肤有小红疙瘩是艾滋病的症状吗,hiv的临床表现是生殖器长疙瘩,0,aids
乳腺癌手术后一定要化疗吗,乳腺癌中期，做切除手术后，是否一定要化疗,1,breast_cancer
慢病政策相关,2型糖尿病有医疗补助政策吗,1,diabetes
糖尿病患者如何做好口腔护理？,糖尿病患者怎样口腔保健比较好呢,1,diabetes
盐敏感性高血压是什么意思,什么是源发性高血压？,0,hypertension
小三阳要喝酒有什么危害,乙肝小三阳有什么危害,1,hepatitis
糖尿病是否能引起头晕，恶心，呕吐？,糖尿病患者今早四肢无力，呕吐，胸闷是怎,1,diabetes
糖尿病人宜喝什么茶好呢？,孕期糖耐量检查前一晚上饱食，第二天9点半测试，行吗,0,diabetes
口水唾沫鼻涕痰能传播艾滋病吗,口水会传染艾滋病吗（别人说话的口水喷到,1,aids
1型糖尿病能治愈吗？可不可以不打胰岛素,一型糖尿病就必须用胰岛素吗,1,diabetes
肾上腺结节会导致高血压吗，如何能确定是肾上腺导致的高血压,怀孕期间引起的高血压,0,hypertension
吃苦瓜桑叶片治疗糖尿病吗,我是糖尿病患者，请问苦瓜桑叶片能治好糖,1,diabetes
长秀霖重组甘精胰岛素一次买十六支农村农保好报销吗?,餐后胰岛素高是什么原因,0,diabetes
乳腺癌骨转移晚期如何用药,乳腺癌骨转移好治疗吗？,0,breast_cancer
请问糖尿病人经常出汗是什么原因？,糖尿病。。血糖高，，浑身出汗，是什么原因、？谢谢大夫。。急,1,diabetes
乳腺癌脑转移放疗有用吗,乳腺癌脑转移还能治愈吗？已经脑转移，患,0,breast_cancer
肛交会传染艾滋病吗,男男口交和肛交容易传染艾滋病吗,0,aids
一岁的宝宝能不能补第二针乙肝免疫球蛋白,乙肝病会不会传染给一起生活的家人,0,hepatitis
你好黄医生糖尿病尿频腹胀怎么办,糖尿病引起尿频怎么治疗,1,diabetes
乙肝大三阳都有哪些传播途径,打乙肝疫苗有副作用吗,0,hepatitis
乳腺癌一定要切除乳房么,乳腺癌晚期了必须切除乳房吗？,1,breast_cancer
糖尿病人老出汗是怎么回事,糖尿病皮肤瘙痒症怎么回事,0,diabetes
糖尿病的控制标准,我的空腹血糖是6.22是糖尿病吗？还有,0,diabetes
糖尿病的最佳治疗方案是啥,糖尿病便秘怎么治,0,diabetes
糖尿病不打胰岛素会怎样,糖尿病并发症怎么减轻,0,diabetes
糖尿病人呕吐腹胀怎么回事,糖尿病首发症状为频繁呕吐吗？频繁到什么,1,diabetes
高血压患者能否坐飞机,高血压可以吃鸭蛋吗？,0,hypertension
乳腺癌肝转移怎么治疗,我乳腺癌转移到肝怎么办，,1,breast_cancer
糖尿病发病的原因是什么？,糖尿病患者尿味重是什么原因？,0,diabetes
糖尿病人可以补血吗？？,糖尿病人缺铁性贫血怎么补血,1,diabetes
2型糖尿病能治好吗可以性生活吗,糖尿病可以过性生活吗？,1,diabetes
糖尿病老人手指手术术后怎样恢复得快？,糖尿病病人做痔疮手术术后如何恢复？,0,diabetes
得了艾滋病会死吗,我感染了hiv会死吗有办法医疗吗,1,aids
hiv出现皮疹痒吗,艾滋病有什么症状。是不是身体特别痒,0,aids
乳腺癌晚期动了手术能活多久,乳腺癌晚期能活多久，,0,breast_cancer
乳腺癌骨转移全身疼痛怎么办,乳腺癌骨转移白天疼吗？,0,breast_cancer
尿糖高，什么能吃？什么不能吃？,糖尿病什么能吃？什么不能吃？主食吃什么？,1,diabetes
糖尿病人可以吃猪蹄吗,糖尿病人可以喝汤吗？该如何喝汤？,1,diabetes
治疗糖尿病有什么新方法吗,糖尿病人的饮食偏方,1,diabetes
糖尿病能喝酸奶吗,糖尿病人适合喝酸奶吗,1,diabetes
通过胃转流手术治疗2型糖尿病效果怎样,糖尿病饮食指南快速问医生,0,diabetes
糖尿病合并症皮肤瘙痒可以用什么外用药可,糖尿病人如何减肥,0,diabetes
糖尿病引起的黄斑水肿怎么治疗好,糖尿病引起腿肿腿疼怎么办,1,diabetes
乙肝病毒携带者吸烟可以吗,乙肝病毒携带者能不能吸烟呢,1,hepatitis
乳腺癌骨转移怎么检查,乳腺癌疾病该怎么在家检查呢？,0,breast_cancer
乙肝患者能抽烟吗怎么保肝护肝,抽血化验前能不能抽烟,0,hepatitis
乳腺癌脑转移的患者能活多久,乳腺癌一般能活多久,0,breast_cancer
打乙肝疫苗前后要注意什么,乙肝大三阳转氨酶升高要治疗,0,hepatitis
糖尿病低糖会死吗?,糖尿病二期能活多久,1,diabetes
糖尿病患者能吃蜂蜜、蜂王浆和蜂巢蜜吗？,你好！糖尿病能喝蜂蜜水吗?,1,diabetes
高血压的人能喝牛奶吗,有高血压能不能喝酸奶,1,hypertension
乙肝患者同时有轻度高血压，用什么降压药好？,白大褂高血压如何确诊？需要治疗吗？如何治疗？,0,hypertension
乙肝通过啥途径传播,乙肝通过什么途径传播，多久才能发现，有,1,hepatitis
糖尿病烂脚有偏方吗,糖尿病是否能治愈,0,diabetes
求糖尿病周围神经病变的治疗方法,糖尿病引发的心脏病，高血压，怎么治疗，,0,diabetes
口交感染艾滋病的几率是多少,有口交感染艾滋病的病例吗,0,aids
糖尿病人能吃的蔬菜有那些,糖尿病患者可以吃荔枝吗？,0,diabetes
宝宝现在4个月23天，可以提前打乙肝疫苗第三针吗,孩子第一针乙肝疫苗和卡介苗不知道打没打，怎么办,0,hepatitis
80岁老人，有心脏病和高血压，现患喉癌，怎样治疗是最好的？,心脏病和高血压的治疗,1,hypertension
检查乙肝五项，需要空腹吗,抽血检验乙肝需要空腹吗检验其他传染病,0,hepatitis
糖尿病病人手术后伤口很难愈合怎么办啊？,糖尿病性眼底出血术后能不能做白内障手术,0,diabetes
乳腺癌一定要切除乳房么,乳腺癌可以不切除乳房吗？,1,breast_cancer
同时患乙肝跟糖尿病该怎么办？,乙肝合并糖尿病怎么治,1,diabetes
怎么区分一型二型糖尿病,糖尿病人可以吃青枣吗,0,diabetes
口jiao会感染艾滋病吗,被动口交会感染艾滋吗,1,aids
糖尿病人能做白内障手术吗,糖尿病引起的白内障怎么办？想变正常还可以吗,0,diabetes
早期乳腺癌会有哪些不适,乳腺癌的早期在有哪些？,1,breast_cancer
糖尿病是怎么形成的？有什么危害？,糖尿病肾病，高血压、心脏病能吃达糖萍吗？会有效果吗,0,diabetes
乙肝通过什么途径传播，多久才能发现，有什么症状,第一针乙肝疫苗多少钱就是孩子出生的第二针,0,hepatitis
脑出血手术后颅压高血压也高还发烧怎么办,高血压脑出血发烧378℃，怎么办,1,hypertension
糖尿病神经病变有什么表现？,老年人得糖尿病的临床表现是什么？,0,diabetes
乳腺癌晚期骨转移严重吗,你好！乳腺癌骨转移好治疗吗,0,breast_cancer
乙肝病毒携带者有什么传播途径,乙肝病毒DNA阳性需要治疗吗,0,hepatitis
糖尿病人都能吃什么食物,糖尿病什么药好,0,diabetes
糖尿病肥胖如何减肥,糖尿病人怎样减肥,1,diabetes
糖尿病会一动就出汗吗,糖尿病人为什么爱睡觉,0,diabetes
糖尿病人怎样控制血糖的升高,糖尿病血糖高，如何降低？,0,diabetes
