question1,question2,label,category
乳腺癌骨转移全身疼痛怎么办,乳腺癌骨转移怎么治疗？,0,breast_cancer
乙肝病毒携带者能结婚吗,乙肝表面抗体和核心抗体阳性怎办呢,0,hepatitis
玉米须的功效与作用糖尿病,玉米须有降血压，糖尿病，治黄疸的功效，,1,diabetes
糖尿病患者多饮水能降血糖吗,糖尿病吃什么叫降血糖,1,diabetes
葡萄糖耐量试验是喝什么样的葡萄糖,糖尿病经常头痛头晕是怎么回事,0,diabetes
艾滋病病毒在液体高温中能存活多久,艾滋病毒在血液能存活多久艾滋病毒血,0,aids
乳腺癌骨转移可以吃止疼药吗,乳腺癌全身骨转移怎么治?,0,breast_cancer
糖尿病人骨折吃什么好,有糖尿病征兆吗？,0,diabetes
乙肝二对半良性怎办,乙肝二对半第二项和第五项阳性怎办,1,hepatitis
尿糖是否是糖尿病?,尿3个号是糖尿病吗该怎么治疗,1,diabetes
糖尿病如何预防低血糖的发生,如何预防糖尿病低血糖,1,diabetes
乙肝会通过性行为传染吗,乙肝大三阳患者和女友性生活会传染吗,1,hepatitis
糖尿病人能吃疙瘩汤吗,糖尿病可以吃猪蹄汤吗,1,diabetes
乙肝表面抗原是其他是什么意思有病,乙肝表面抗原225、乙肝核心抗体317是什么意思,1,hepatitis
高血压虚要做那些检查,咨询发现高血压需要去医院做哪些检查,1,hypertension
乙肝腰痛应注意什么,患乙肝应该注意什么饮食要注意什么,0,hepatitis
高血压脑梗患者可以补钙吗,患有高血压和心脏病的老年人可以吃钙片吗？,1,hypertension
高血压高血脂高血糖能吃枸杞么,高血压怎么治疗、,0,hypertension
血糖过低怎么办好？,糖尿病肢端溃烂应该怎样护理和治疗？,0,diabetes
乳腺癌早期有可能有哪些症状,想问问乳腺癌的早期症状有哪些呢,1,breast_cancer
检查哪些指标判断是否得了急性乙肝,急性乙肝如何治疗,0,hepatitis
乳腺癌晚期还能治好吗,乳腺癌晚期能治好吗?,1,breast_cancer
孕妇糖尿病的症状,请问孕妇在孕期患糖尿病会有什么症状吗,1,diabetes
糖耐量下降会发展成糖尿病吗,糖耐量低下都要发展成糖尿病吗？,1,diabetes
带安全套和朋友做爱性交会感染艾滋病吗,和朋友戴套做爱会传染艾滋病吗,1,aids
小便时感觉有股甜味，这是不是糖尿病？,糖尿病尿是甜的吗,1,diabetes
糖尿病会不会引起呕吐,为什么打胰岛素体重胖了很多,0,diabetes
乳腺癌会死吗,乳腺癌，会不会死亡啊？,1,breast_cancer
血稠、高血压和心脏病的如何治疗。,高血压心脏病如何治疗,1,hypertension
我现在是急性乙肝恢复期，这恢复期会传染吗,恢复期能打乙肝疫苗吗,0,hepatitis
糖尿病人为啥会低血糖？,糖尿病人血糖低是怎么回事,1,diabetes
糖尿病足患者应在什么科室就诊？,糖尿病复查要挂哪个科,0,diabetes
1型糖尿病会传染吗？,糖尿病传染吗？怎样能传染,0,diabetes
这样的症状是高血压吗？,这样算是高血压吗,1,hypertension
糖尿病人需注意那些事项?,糖尿病酮症酸中毒护理措施,1,diabetes
糖尿病人出现手脚无力怎么办,糖尿病人浑身无力该怎么办？,1,diabetes
茵陈红枣白菊花汤乙肝患者可以喝么,乙肝活动期转氨酶高的人能吃红枣吗谢谢,1,hepatitis
糖尿病人能吃绿豆汤吗,糖尿病人吃豆腐顶主食吗？,1,diabetes
糖尿病可以试管吗,糖尿病能做试管吗,1,diabetes
口交感染艾滋病的几率是多少,口交痛与艾滋病几率,1,aids
孕妇做葡萄糖耐量试验,怀孕多少周应该做糖尿病筛查？,1,diabetes
七岁的儿童早上空腹验血糖6.8是不是糖尿病,儿童餐前血糖6.8餐后6.9是不是糖尿病,1,diabetes
高血压可以喝什么补汤,萝卜汁能治高血压吗可以么,0,hypertension
乙肝病毒携带者能否办健康证,男性有乙肝两对半阳性可以办餐饮类健康证吗,1,hepatitis
糖尿病人不能吃的食物有哪些？,糖尿病能吃什么水果，不能吃什么？血糖1,1,diabetes
尿里有糖就是糖尿病吗？,我的空腹血糖6.6，这是糖尿病吗,0,diabetes
糖尿病酮症酸中毒原因,糖尿病患者引发酮中毒的原因,1,diabetes
糖尿病应打什么胰岛素针（进口的或国产的）？,胰岛素分泌滞后应打什么针,1,diabetes
乳房有硬块是不是乳腺癌,乳房有硬块会导致乳腺癌吗？,1,breast_cancer
灵芝茶对乙肝患者有效吗25岁能喝吗,乙肝有呕吐的症状吗,0,hepatitis
手淫自慰是否会感染艾滋病,女的经常手淫有时从外面回来就会如果接触艾滋病人回来后手淫会得艾滋病吗,0,aids
高血压会不会导致动脉硬化引起阳痿,请问高血压跟睡眠有关系,0,hypertension
10年糖尿病，最近餐后血糖11，如何治疗呢？谢谢！,糖尿病人餐后血糖应该控制多少,1,diabetes
乙肝医保可以报吗,治疗乙肝，干扰素那里有卖，一般医保可以报,1,hepatitis
高血压孕妇可以顺产吗,高血压患者吃蛋白粉有没有负作用？,0,hypertension
乙肝大三阳熬夜的危害,乙肝小三阳经常熬夜、饮酒和吸烟对身体有害吗,0,hepatitis
【关于鸡肉的用药疑问】高血压糖尿病可以吃鸡肉吗,高血压能吃豆腐和鸡肉之类的吗？,0,hypertension
乳腺癌肝转移怎么治疗,乳腺癌晚期肝转移骨转移怎么治,0,breast_cancer
口交感染艾滋病的几率是多少,那如果对方是艾滋病，那感染几率是多,0,aids
一型糖尿病15年还能做干细胞移植手术吗,糖尿病人会容易疲劳吗,0,diabetes
肾萎缩、肾囊肿是否会引起高血压,肾囊肿能因发高血压吗,1,hypertension
糖尿病人感冒了怎么办,糖尿病患者感冒怎么办,1,diabetes
糖尿病影响寿命吗,糖尿病人影响寿命吗,1,diabetes
除了拜糖苹还有什么药控制血糖,糖尿病看什么科室,0,diabetes
糖尿病降血糖常用药,爱能罗格列铜片能与格列奇特缓释片合用降血糖吗?,1,diabetes
什么是肾源性高血压检查怎么,高血压最有效的治疗方法是什么？,0,hypertension
手淫自慰是否会感染艾滋病,触摸过艾滋病人东西然后手淫会感染吗,1,aids
轻微糖尿病能逆转吗？如何逆转,可以治愈糖尿病吗,1,diabetes
只打一针乙肝疫苗有什么副作用,乙肝疫苗接种禁忌有哪些,0,hepatitis
糖尿病人如何保养肝肾,糖尿病人如何调理肝脏,1,diabetes
高血压的病人一般都输什么液呢？,父亲是高血压患者我想请问一下有没有什么查可以治疗高血压的,0,hypertension
乙肝核心抗体179是否属正常,乙肝疫苗对宝宝有影响吗,0,hepatitis
糖尿病可以拔牙吗,牙根上有包能不能拔牙【有糖尿病】,1,diabetes
有艾滋病可以做爱吗,做爱不带套会得吗几率是多少,0,aids
有高血压，还有前列腺增生怎么办？,父亲60岁患有高血压，现在又有前列腺增生请问医生敢做手术吗,1,hypertension
糖尿病人能不能吃红豆薏米粥,糖尿病人骨折了可以吃豆腐吗？,1,diabetes
我也是乙肝携带患者，可以办健康证吗在,乙肝五项化验单怎么看呢,0,hepatitis
糖尿病可以吃中药吗,中医怎么治疗糖尿病？,1,diabetes
艾滋病感染初期会出现什么症状,艾滋病的初期有什么症状,1,aids
糖尿病腹泻20年了怎么办啊？？？,糖尿病长期腹泻怎么办？,1,diabetes
担心会不会感染艾滋病hiv,戴套kj，会不会感染hiv,0,aids
糖尿病人做外科手术应注意事项,糖尿病一般要注意哪些？,0,diabetes
宝宝出生第三天才打第一针乙肝疫苗可以吗,宝宝的第二针疫苗能不能过3个月在打,1,hepatitis
糖尿病人能吃鸡蛋吗？怎样吃才合理？,脑梗死，糖尿病，胃不好，适合吃鸡蛋水吗,1,diabetes
高血压引起的主动脉夹层手术危险吗,20岁高血压是不是很危险？,1,hypertension
小儿乙肝怎么治疗,小儿乙肝预防,0,hepatitis
怎么打胰岛素,糖尿病能吃莲子吗,0,diabetes
男人会得乳腺癌吗,男性会得乳腺癌吗,1,breast_cancer
艾滋病主要通过什么途径传播,艾滋病的传播途径日常生活怎么防治艾滋病的传播途径日常生活怎么防治,1,aids
我糖尿病6年，近未服药血糖8到9要服药吗、请回答我,早上空腹，葡萄糖是12.01不吃药能控制血糖吗,1,diabetes
你好高血压会小腿至脚背浮肿吗,高血压会不会有脸部水肿,1,hypertension
糖尿病人可以吃羊肉罗卜汤吗,糖尿病患者可以吃羊肉吗,1,diabetes
你好，请问糖尿病人可以吃什么蔬菜，不可,吃东北大豆对糖尿病有帮助吗,0,diabetes
糖尿病老是饿怎么办,糖尿病，没了欲望，怎么办？,0,diabetes
胃转流手术可以治愈糖尿病吗,糖尿病如何应对感冒？,0,diabetes
您好我母亲糖尿病这几天胸闷气短是怎么回事,糖耐量13其他各项指标正常能确诊为糖尿病吗,0,diabetes
糖耐量异常名词解释,ogtt和glu是一回事吗,1,diabetes
糖耐量试验为什么是75克葡萄糖？,我的葡萄糖8.38，请问是不是属于严重的糖尿病,0,diabetes
钞票是否会传染艾滋病,口交是否可传染艾滋病,0,aids
糖尿病会引发尿毒症吗？,血糖过高跟糖尿病有什么关系没有？,0,diabetes
乙肝母婴传播怎阻断,乙肝通过什么传播，如何预防,0,hepatitis
高血压是怎样引起的,高血压的病因是什么,1,hypertension
不吃饭或吃的很少的情况下，降糖药还能继续吃吗,早期糖尿病要不要吃药,0,diabetes
如何防止乳腺增生癌变,怎么防止乳腺癌出现,0,breast_cancer
糖尿病人嘴麻，腿疼怎么办,糖尿病患者，手脚发热难入眠，怎么治疗,1,diabetes
我有乙肝但是检查的时候说不用吃药可以办健康证吗,乙肝患者能不能办批发服装行业的健康证,1,hepatitis
薏米红豆粥糖尿病人人可以喝吗，刚发现，,糖尿病人可以吃黄豆吗,1,diabetes
无套口交会感染hiv吗,dtxj会感染hiv吗,0,aids
艾滋病主要通过什么途径传播,艾滋病意外传播途径有哪些如：公用剃须刀,1,aids
有乙肝病史的体检应该检查哪些项目,乙肝小山羊复查的项目要检查什么项目,0,hepatitis
糖尿病患者早上能喝牛奶吗,糖尿病人严重便秘怎莫解决,0,diabetes
高血压患者应该看什么科,请问我要看高血压挂哪个科心脏内科血液内科心血管外科,0,hypertension
糖尿病人有伤口不愈合怎么办,糖尿病人截了脚趾但伤口不愈合怎么办？急急,1,diabetes
糖尿病人打胰岛素有何副作用,糖尿病患者并发症该如何预防？,0,diabetes
皮肤有小红疙瘩是艾滋病的症状吗,阴茎上起了小疙瘩是不是艾滋病,1,aids
乳腺癌晚期骨转移严重吗,乳腺癌会导致骨转移的情况吗？,0,breast_cancer
糖尿病烫伤怎么办,老年人糖尿病水肿怎么处理,0,diabetes
乙肝e抗体和乙肝核心抗体阳性是不是乙肝,乙肝e抗体阳性，乙肝核心抗体阳性怎么办,1,hepatitis
艾滋病人的寿命有多长,艾滋病人的寿病有多长,1,aids
我的糖尿病前期需要用药吗,糖尿病，血糖21.5-21.6要去医院吗，只靠自己吃药可以吗？,1,diabetes
糖尿病酮症酸中毒是什么原因引起的？,糖尿病酮症酸中毒一个加号,0,diabetes
年轻人高血压是什么原因引起的,如何判断高血压是否危险？,0,hypertension
二型糖尿病主食吃什么好，吃多少,二型糖尿病吃什么要好？,1,diabetes
糖尿病人能多喝水吗,请问糖尿病多喝水可以吗？,1,diabetes
打胰岛素效果不明显怎么办,糖尿病血糖居高不下打胰岛素也无法控制怎,1,diabetes
乳腺癌手术后还能活多久,乳腺癌切除还能活多久？,1,breast_cancer
高血压能喝豆浆吗？,高血压20多天降了又升不稳定怎么办？,0,hypertension
乳腺癌晚期还能活多久呢,乳腺癌晚期患者能活多久？,1,breast_cancer
痛风还有糖尿病和高血压，能不能吃黑花生，黑花生和一般花生含量不同的,高血压的人可以吃用南瓜晒的南瓜干吗？,1,hypertension
什么叫乙肝恢复期,乙肝检查有两个加号严重吗,0,hepatitis
分析下尿毒症伴有高血压贫血患者是否能坐飞机？,高血压患者能否坐飞机,1,hypertension
糖尿病人腹部胀气肚子疼怎么回事,我的母亲得糖尿病2年了，喝药喝的腹部胀气怎么回事？,1,diabetes
高血压药影响性功能吗,高血压哪几种药不引起性欲下降,1,hypertension
糖尿病人便秘该怎么办,糖尿病人便秘怎么治疗,1,diabetes
手淫自慰是否会感染艾滋病,被站街女无套手淫会传染艾滋病吗阴,1,aids
糖尿病能喝甜的酸奶吗,您好，请问糖尿病人能否喝酸奶,1,diabetes
餐后血糖低于空腹血糖是为什么？,空腹血糖6.6餐后血糖6.5是糖尿病吗,1,diabetes
颈椎病能否引起高血压,颈椎病和高血压的关系？,1,hypertension
糖尿病神经痛怎么治疗,餐后血糖怎么测,0,diabetes
糖尿病如何处理伤口,糖尿病到了皮肤不愈合的程度有什么方法治疗？,1,diabetes
乳腺癌肿瘤标志物的特点,肿瘤三项能查出乳腺癌吗,0,breast_cancer
乙肝疫苗第二针和第一针间隔37天可以吗多一个周,分娩时打乙肝免疫球蛋白针么,0,hepatitis
糖尿病人服用优甲乐有时胸闷是咋回事,糖尿病人胸闷是什么原因?,1,diabetes
怎样验血糖？,糖尿病多年最近右手发抖请问什么原因,0,diabetes
心脏病怎么治好多年患有高血压心脏病在医,高血压心脏病怎么治？,1,hypertension
乙肝患者如何保健,我是乙肝大三阳，去做婚前检查能通过吗能结婚吗,0,hepatitis
治疗糖尿病有什么好方法？,控制或者糖尿病有偏方吗？？,1,diabetes
小孩子爱吃糖与糖尿病有关么？,糖尿病和吃糖的关系,1,diabetes
餐后血糖是15点7算是糖尿病吗,孕期糖尿病不打胰岛素行吗,0,diabetes
性接触是如何感染艾滋病毒的,尿道炎会是接触艾滋病毒感染的吗,0,aids
精液、阴道分泌物能传染艾滋病吗,如果手摸到艾滋病人的精液会被传染吗,1,aids
糖尿病患者的伤口怎样才能愈合快,糖尿病人伤口如何处理,1,diabetes
干细胞移植糖尿病是否能够根治病,干细胞移植能治疗糖尿病吗？,1,diabetes
嘴里口水发甜是糖尿病吗,2型糖尿病男人可以要孩子按吗,0,diabetes
乙肝都是怎么被传染上的唾液能传播么,乙肝患者可以并发胃病吗,0,hepatitis
我有乙肝小三阳，能否生孩子能吗,一方得了乙肝一方正常在平常生活中接吻会传染吗,0,hepatitis
我是2型糖尿病患者，可以要小孩吗,男方有糖尿病能要孩子么,0,diabetes
糖尿病发病的原因是什么？,糖尿病是怎么得的人为什么会得糖尿病,1,diabetes
侵润性导管乳腺癌如何治疗,侵润性乳腺癌咨询治疗方法,1,breast_cancer
二型糖尿病能吃伟哥吗,二型糖尿病吃什么粥好,0,diabetes
产妇有糖尿病能喝乌鸡汤吗?,糖尿病人能吃鸡蛋么,0,diabetes
高血压病人忽然想呕吐该怎办,高血压导致呕吐怎么办,1,hypertension
有高血压糖尿病的发生呕吐是什么原因,糖尿病会不会引起呕吐,1,diabetes
疸黄偏高是否说明有乙肝,感觉最近皮肤发黄是不是黄疸，乙肝会引起黄疸吗,1,hepatitis
糖尿病会导致腿抽筋吗,糖尿病性生活传不传染,0,diabetes
请问高血压能吃鲫鱼花生核桃吗？,高血压可以吃杏仁吗,1,hypertension
糖尿病人怎么有效降血糖,血糖高是糖尿病吗怎样降血糖,1,diabetes
恶性高血压饮食方案,我患上恶性高血压该怎办,1,hypertension
糖尿病的运动治疗,糖尿病人运动如何适度？,1,diabetes
艾滋病会不会通过蚊子传播,拍死的蚊子血会不会传染艾滋病,1,aids
深圳治疗乙肝多少钱,治疗乙肝最多要多少钱,1,hepatitis
什么是糖尿病乳酸性酸中毒？,糖尿病监测的方法,0,diabetes
糖尿病人为什么要少泡热水澡,糖尿病人泡热水澡好吗,1,diabetes
糖尿病患者怎么增肥,糖尿病多年了.人越来越瘦了怎么办.平时,1,diabetes
手脚麻木是不是糖尿病神经性病变,糖尿病病变性神经炎要挂什么科室？？,0,diabetes
餐后血糖多高可以诊断为了糖尿病,糖尿病系列检查，都査些什么？,0,diabetes
糖尿病人补血补气吃什么最好,糖尿病贫血怎么补血,1,diabetes
糖尿病的女人能否怀孕？,糖尿病肾病可以怀孕吗,1,diabetes
尿酸520，可服什么药好，有高血压。,高血压，尿酸高，该如何用药,1,hypertension
贲门癌，有糖尿病高血压冠心病心梗怎么治疗,高血压、冠心病如何治疗,1,hypertension
糖尿病会变成尿毒症吗,糖尿病人吃西瓜可以吗,0,diabetes
头晕四肢麻木高血压吃什么药,高血压病人眼睛充血怎么办,0,hypertension
妊娠期高血压是什么意思,妊娠期高血压疾病分类,0,hypertension
乳腺癌骨转移全身疼痛怎么办,乳腺癌骨转移怎么治疗，,0,breast_cancer
糖尿病引起的烂脚能治疗吗,糖尿病人能吃西洋参吗,0,diabetes
一般血常规检查，能检得出是乙肝病毒携带者吗,新生儿感染乙肝病毒怎么办,0,hepatitis
男性有乙肝两对半阳性可以办餐饮类健康证,有乙肝还可以领健康证吗,1,hepatitis
三高咋治需要用什么药可以快速治愈,临界高血压有什么土方法治疗,0,hypertension
你好，我的亲属糖尿病，控制的不好，怎么办，谢谢,糖尿病腹胀是怎么回事,0,diabetes
乙肝可哺乳吗,说话吃饭能传染乙肝吗,0,hepatitis
糖尿病人为什么会脚肿？,糖尿病人嘴巴为什么会肿大,1,diabetes
乳腺癌骨转移可以吃止疼药吗,乳腺癌骨转移能吃红景天吗,0,breast_cancer
糖尿病血管病变怎么治,糖尿病腿疼小血管有病变怎么治疗,1,diabetes
诊断糖尿病应在哪个科室？,要去检查糖尿病该挂什么科,1,diabetes
糖尿病打胰岛素的时间间隔是多少,胰岛素对初期糖尿病是早打早好吗？,0,diabetes
糖尿病患者如何做好口腔护理？,患了糖尿病怎么护理呢？,0,diabetes
糖尿病能用中药根治吗？,糖尿病能用手术根治吗？,0,diabetes
糖尿病皮肤病吃什么药,肥胖的人为什么更容易得糖尿病呢？,0,diabetes
高血压，高血脂吃什么坚果好,醋花生对高血压有用吗要注意什么吗,1,hypertension
我妈妈不常吃糖，为什么会得Ⅱ型糖尿病？,为什么叫2型糖尿病,0,diabetes
早期乳腺癌会有哪些不适,初期乳腺癌会有哪些症状？,1,breast_cancer
糖尿病患者可以吃开心果吗,糖尿病吃核桃好吗,1,diabetes
吃糖多，会得糖尿病不,吃甜食多会得糖尿病吗,1,diabetes
高血压尿酸高吃什么药好,高血压尿酸高怎么办,1,hypertension
乳腺癌晚期还能治好吗,乳腺癌晚期还可以治好吗,1,breast_cancer
肾虚是不是很容易得糖尿病啊,糖尿病人容易得ED吗？,0,diabetes
尿糖两个加号算是糖尿病吗？,糖尿病引起眼睛看不清东西怎么办?,0,diabetes
因为不知道乙肝小三阳病人是不可以吃羊肉,乙肝患者能吃牛羊肉吗还有能吃梨吗,0,hepatitis
地特胰岛素注射液价格,有谁知道重组甘精胰岛素的价格？,1,diabetes
糖尿病想吃匹多莫德增加免疫力。,糖尿病人免疫力低怎么办？,1,diabetes
糖尿病人尿液有泡沫是怎么回事,尿液混浊是糖尿病的征兆吗,1,diabetes
乳房有肿块是不是乳腺癌,乳房有肿块是不是乳腺癌啊？,1,breast_cancer
乙肝为什么会反复病发,乙肝大便发黑是为什么,0,hepatitis
糖尿病足的预防方法,糖尿病人如何预防失明？,0,diabetes
患有糖尿病可以怀孕吗？,孕期糖尿病对胎儿有那些影响,0,diabetes
三十出头的糖尿病能活多久,糖尿病会死亡吗,1,diabetes
遗传异质性,糖尿病人可以每天拔罐吗？,0,diabetes
一型糖尿病能吃螃蟹吗？,一型糖尿病人吃什么？,1,diabetes
高血压怎么治疗？,治疗高血压什么方法最好,1,hypertension
乳腺癌晚期还能活多久呢,乳腺癌晚期转移病人术后能活多久,0,breast_cancer
妊娠糖尿病会遗传给女儿吗,妊娠糖尿病的宝宝会遗传吗,1,diabetes
血糖仪能查出糖尿病吗,糖尿病血糖仪会出问题吗,0,diabetes
妊娠糖尿病危害有哪些,妊娠糖尿病对胎儿对我有什么重大危害吗？,1,diabetes
隐性乳腺癌有什么症状,乳腺癌有什么明显的症状吗？,0,breast_cancer
吃什么主食对糖尿病有帮助？,喜欢吃甜食，有糖尿病吗?,0,diabetes
同性为什么容易得艾滋病呢,哪些性交容易得艾滋病,0,aids
乳腺癌晚期转移会出现什么症状呢,患有乳腺癌的患者会出现什么症状呢，,0,breast_cancer
查糖尿病的尿检需要空腹吗,测尿糖需要空腹吗,1,diabetes
高血压后遗症偏瘫如何恢复,怎样治疗更好会不会留下后遗症,0,hypertension
血糖8?2尿三个加号，是二型糖尿病吗,糖尿病是因什么引发的,0,diabetes
糖尿病平时喝什么养生,糖尿病秋季如何养生,1,diabetes
我得了高血压病吗？怎样防治？,如何预防高血压肾病？,0,hypertension
带安全套和朋友做爱性交会感染艾滋病吗,带安全套和朋友性交会感染艾滋病吗1,1,aids
这种情况有可能会感染上艾滋病吗,你说以上的情况我会感染艾滋病吗,1,aids
乙肝抗病毒耐药如何治疗呢,如何治疗乙肝病毒变异,0,hepatitis
糖尿病肾病患者应该选用什么降糖药物？,糖尿病肾病吃什么降糖药好,1,diabetes
乳房有肿块是不是乳腺癌,乳房旁边有肿块不知是不是乳腺癌,1,breast_cancer
糖尿病引起的白内障可以做手术吗？,84岁患有高血压糖尿病能做白内障手术吗,0,diabetes
葡萄糖,什么是糖尿病神经病变？,0,diabetes
乙肝患者为什么会出现黄疸,乙肝患者出现黄疸的原因在哪里,1,hepatitis
伤口与艾滋病患者接触会传染吗,手上伤口还没完全愈合会传染hiv吗,0,aids
苦瓜治糖尿病怎么样吃有效果,糖尿病吃洋葱好不好,1,diabetes
我想治疗乙肝大三阳怎么治吃什么药,乙肝大三阳的话应该吃什么药,1,hepatitis
艾滋病传播几率,艾滋病性传播的传播率,1,aids
妊娠糖尿病需要复查吗,妊娠糖尿病要复查吗,1,diabetes
打完乙肝疫苗后可以饮酒吗,乙肝小三阳可以打乙肝疫苗吗,1,hepatitis
有糖尿病身上痒可以治疗吗,糖尿病人身上痒严重吗,1,diabetes
糖尿病人得了甲亢饮食要注意什么,春季糖尿病人痛风甲亢病人吃什么,1,diabetes
妊娠期糖尿病治疗饮食,妊娠期糖尿病如何饮食,1,diabetes
怎么预防糖尿病并发症,糖尿病有什么并发症吗,0,diabetes
高血压有什么有效的治疗方法吗？,年轻人高血压是有什么原因引起的,1,hypertension
乙肝病毒DNA指标检查，需要空腹吗,检查乙肝需要空腹吗,1,hepatitis
你好！高血压不吃药可以吗！10015,因高血压引起的眩晕症怎样治疗？是否可以痊愈？,0,hypertension
糖尿病低血糖是什么原因？应该如何应对？,糖尿病胃转流手术后，浑身疼痛难忍，咋办,0,diabetes
糖尿病可以吃稀饭，吃玉米粥吗？,糖尿病人吃玉米可以吗,1,diabetes
慢性乙肝饮食要注意怎么,生活，饮食，须注意什么,0,hepatitis
糖尿病发现肿是怎么回事,糖尿病下肢会浮肿吗,1,diabetes
薛主任，糖尿病人眼底出血怎么办？,糖尿病人该送什么合适,0,diabetes
乳腺癌手术后还能活多久,乳腺癌扩散还能治疗吗能活多久,0,breast_cancer
艾滋病毒离开人体能够存活多久，还具有传染性么,带有艾滋病病毒的体液在密封的盒子里，能够存活多久,1,aids
糖尿病人能喝含蔗糖的保健品口服液吗？,糖尿病人吃什么保健品好呀？,1,diabetes
口交传染艾滋病的可能性大吗,口交传播艾滋病吗,0,aids
糖尿病能喝奶粉吗？,糖尿病患者能吃维生素b族片吗,1,diabetes
糖尿病人烫伤如何处理,葡萄糖7.88是糖尿病吗,0,diabetes
乙肝表面抗体（HBSAB阳性是什么意思,有小三阳但是乙肝表面抗原为阴性是什么意思,1,hepatitis
成人血糖正常范围,您好，糖尿病人，血糖7.3算正常吗？,0,diabetes
糖尿病烫伤不愈合咋办,如何治疗糖尿病人的脚部烫伤,1,diabetes
乳腺癌化疗后白细胞偏低怎么办,乳腺癌术后化疗白细胞低怎样提升,1,breast_cancer
干细胞治疗糖尿病大概费用是多少,糖尿病治疗要多长时间？费用是多少,1,diabetes
hiv预防,想知道艾滋病该怎么样预防怎么样才不会被,1,aids
糖尿病人多吃苹果少吃香蕉,糖尿病能吃香蕉吗？请帮我解答，听别人说…,1,diabetes
乙肝转阴算治愈了吗,查乙肝五项用空腹吗，245阳性会传染胎儿吗,0,hepatitis
糖尿病神经病变有什么症状？,请问糖尿病有什么表现,0,diabetes
乙肝转氨酶升高了怎么办,转氨酶升高会有什么后果,0,hepatitis
孕辰糖尿病吃什么水果,妊娠糖尿病吃什么水果好,1,diabetes
这样是高血压病吗,高血压是怎么诊断的,1,hypertension
乙肝患者易贫血的原因是什么,乙肝患者容易出血的原因有哪些,0,hepatitis
糖尿病分为哪几种,糖尿病病发症的类型有哪几种,0,diabetes
糖尿病患者能不能多吃鸡蛋？,糖尿病人可以吃土鸡蛋吗？,1,diabetes
高血压药影响性功能吗,有什么高血压药物会导致甘油三脂升高,0,hypertension
乙肝女性生孩子会一定有乙肝吗,乙肝病毒携带者生的孩子一定也是病毒携带者么,1,hepatitis
乳腺癌一定要切除乳房么,乳腺癌能不能不切除乳房？,1,breast_cancer
