question1,question2,label,category
那些运动适合高血压患者，游泳可以吗？,心脏造影LAD中段末50狭窄，有高血压，怎么治疗，可否游泳。谢谢,1,hypertension
乳腺癌脑转移的患者能活多久,乳腺癌扩散到腋窝能活多久？,0,breast_cancer
检查出有乙肝小二阳，我该怎么治疗，自体,检查乙肝小二阳，该如何治疗,0,hepatitis
高血压与心肌炎有什么关系,心肌桥的形成是先天的吗跟高血压有关系吗,0,hypertension
您好请问一型糖尿病注定终身注射胰岛素吗,2型糖尿病是不是要打一辈子针？,1,diabetes
乙肝为什么会反复病发,乙肝老是复发是什么原因如何治疗,1,hepatitis
艾滋病人体液溅到眼睛里会感染艾滋病吗,可能接触他人体液会不会感染艾滋病有会不,0,aids
血糖怎么控制，医生进！200分！,我的糖尿病才发现怎样降糖和控制血糖,1,diabetes
妊娠期糖尿病常见于哪些人？,妊娠糖尿病有什么特点？,0,diabetes
高血压能不能根治啊,40岁男性，我的高血压能治好吗,1,hypertension
糖尿病人身上痒严重吗,糖尿病病合并痛风该如何治疗,0,diabetes
中国糖尿病人有多少,中国糖尿病发病率是多少,1,diabetes
您好，二型糖尿病的人能吃什么,二型糖尿病吃什么粥好,1,diabetes
糖尿病是否可以要孩子？,怀孕可以用优泌林吗？,0,diabetes
糖尿病患者可以喝酸奶吗？哪种好一点？,糖尿病能不能喝酸奶,1,diabetes
乳腺增生会引起乳腺癌吗,乳腺增生会逐渐演变成乳腺癌吗？,1,breast_cancer
艾滋病发烧是什么样的,艾滋病发作是什么样的,0,aids
和患有乙肝的人在一起生活，会传染吗该注意什么,跟乙肝大三阳患者一起生活要注意哪些呢,1,hepatitis
糖尿病人会尿频尿急吗？怎么回事？,怎么才能防止糖尿病,0,diabetes
艾滋病人的口水会不会传染,艾滋病人的唾液能传染艾滋病吗,1,aids
糖尿病要怎么治才能好,糖尿病会头晕吗,0,diabetes
在洗脚房修脚、理发店理发被刀片划破出血会感染艾滋病吗,理发店理发被刀片划破出血令感染艾滋病毒,1,aids
乳腺癌骨转移治疗方法,乳腺癌骨转移后如何治疗?,1,breast_cancer
糖尿病脚烫伤怎么处理,二型糖尿病，应该注意什么。,0,diabetes
乙型肝炎病毒相关性肾炎检查项目哪些,乙型肝炎病毒“两对半是要抽血来做检查吗,0,hepatitis
糖尿病人的汗有糖分吗？,糖尿病2型会影响月经吗,0,diabetes
乳腺癌转移到脑部怎么办,乳腺癌扩散到脑部！恳求治疗方案！,0,breast_cancer
有高血压和冠心病对做胃镜有没有影响？,高血压是不是不可以做胃镜啊,1,hypertension
入职体检表还要检查乙肝吗,乙肝病原携带者能当通过大学老师入职体检吗,1,hepatitis
糖尿病人可以吃红薯么,怀孕七个月了孕期糖尿病怎么办啊,0,diabetes
艾滋病吃什么药效果好,艾滋病戒断药在哪儿买啊吃药能有效吗有没有更好的效果的药啊,0,aids
有乙肝要办健康证去做健身房接待工作，医,单纯的乙肝核心抗体阳性可以办健康证吗,1,hepatitis
糖尿病患者性生活会不会传染,糖尿病会传染的吗,1,diabetes
治糖尿病最佳方法,有糖尿病的人怎么锻炼,0,diabetes
糖尿病人出现蛋白尿是怎么回事,糖尿病引起的尿蛋白曾高是怎么回事,1,diabetes
糖尿病人能吃壮阳药吗,有糖尿病能吃伟哥吗？,1,diabetes
糖尿病人可以吃红枣吗?,糖尿病人能不能吃苹果？,1,diabetes
乳腺癌已做切除手术后续怎么治疗,乳腺癌患者的后续治疗,0,breast_cancer
妊娠糖尿病坐月子食谱,二型糖尿病能要小孩吗,0,diabetes
糖尿病患者能不能打葡萄糖溶液？应该怎么打？,糖尿病怎么打对？,0,diabetes
糖尿病吃什么保健品好,请问糖尿病人能吃无限极海豹油吗？,1,diabetes
老年人高血压危象的定义,老年人高血压危象,1,hypertension
妊娠糖尿病筛查能用血糖仪测试吗,中频经络通糖尿病治疗仪能治愈糖尿病吗？,0,diabetes
艾滋病病毒在液体高温中能存活多久,艾滋病毒在别人的汗液中能存活多长时间,0,aids
皮肤有小红疙瘩是艾滋病的症状吗,郑医师我想问你身上有红疙瘩的算是艾滋病的症状吗,1,aids
乙肝六项全阴这是什么情况,我的乙肝是五项全是阴性，我该注意什么,1,hepatitis
乳腺癌转移到肺能活多久,乳腺癌淋巴结转移能活多久？,0,breast_cancer
这样会感染hiv吗,这样会不会感染hiv。谢谢了,1,aids
乙肝大三阳应忌吃什么,乙肝大三阳应该吃什么药日常生活中应该注意些什么,0,hepatitis
高血压高血糖高血脂饮食需要注意哪些,高血压，高血脂怎么办,1,hypertension
糖尿病做手术可以治愈吗？,糖尿病人贫血怎么补血,0,diabetes
高血压、糖尿病人吃什么可以增加抵抗力,糖尿病怎么增强免疫力和抵抗力,1,diabetes
I型糖尿病会遗传吗,1型糖尿病可以生孩子吗,1,diabetes
乳腺癌晚期还能治好吗,晚期的乳腺癌还能不能治好？,1,breast_cancer
早期乙肝患者会有哪些症状,乙肝是有哪些症状有啥提示乙肝的症状,1,hepatitis
糖耐量异常也会导致体重明显下降吗？,糖耐量异常和糖尿病有什么区别,1,diabetes
打乙肝疫苗可否怀孕,打完乙肝疫苗多久可以要孩子,1,hepatitis
有头晕分不清方向和视力下降的症状，还有记忆力下降,我有原发性高血压，目前主要出现头晕，记忆力下降，多梦，磁共振检查结果缺血灶，请问吃什么药治疗,1,hypertension
糖尿病可以吃红枣吗,糖尿病的可以吃红枣吗,1,diabetes
糖尿病症状都有哪些？,请问大夫糖尿病都有哪些症状,1,diabetes
治高血压有特效药吗？,中医有治疗高血压的特效药吗？,1,hypertension
乳腺纤维瘤是乳腺癌吗,乳腺纤维瘤和乳腺癌有关系吗,0,breast_cancer
高血压贫血怎么办,患有高血压又有贫血怎么办,1,hypertension
糖尿病并发痛风怎么治疗,痛风加糖尿病怎么治疗,1,diabetes
糖尿病女人做流产有危险吗,非空腹血糖的定义,0,diabetes
糖尿病对孕妇、胎儿及新生而有什么影响呢？,糖尿病对妊娠的影响,0,diabetes
乙肝高血压如何用药,有乙肝病要如何控制高血压,1,hypertension
我是高血压患者已经两年了，吃药一年最近听说芹菜籽和红豆绿豆姜片能降压我可以煮水喝吗,高血压和脑梗塞的治疗,0,hypertension
艾滋病跟尖锐湿疣、梅毒有联系么,艾滋梅毒尖锐湿疣，现在舌下有肉芽,0,aids
糖尿病引起呕吐后怎么治疗,糖尿病人发烧后呕吐怎么办？,1,diabetes
乙肝治疗的最新方法,乙肝病毒DNA定量PCR荧光定量法结果,0,hepatitis
治疗糖尿病一个疗程需要多少钱餐前14.,请问医院治糖尿病得多少钱,1,diabetes
高血压喝完15两白酒血压反而降低是为什么？,高血压可以喝啤酒吗？,1,hypertension
带安全套和朋友做爱性交会感染艾滋病吗,带安全套和朋友,0,aids
测血糖要注意什么？哪些因素会影响血糖检测的准确性？,糖尿病患者每天早上吃充蛋会使血糖升高吗？,0,diabetes
乙肝关节痛能治么,乙肝大三阳关节疼痛可以补钙吗,1,hepatitis
老年人糖尿病乳酸性中毒食谱大全,老年人糖尿病乳酸性中毒吃什么水果,1,diabetes
早期糖尿病人吃秋葵可以降糖吗,甲减容易得糖尿病吗,0,diabetes
乳腺癌骨转移可以吃止疼药吗,乳腺癌6年会骨转移吗？,0,breast_cancer
我老妈有糖尿病又有脂肪肝吃什么,嘴巴发甜是糖尿病么？,0,diabetes
乳腺癌骨转移全身疼痛怎么办,乳腺癌骨转移，吃不进去东西怎么办,0,breast_cancer
2型糖尿病人可以吃蛋吗？,你好！糖尿病人能不能吃鸡蛋,1,diabetes
高血压老人能做胃镜吗？,高血压糖尿病人可以做脾切除吗,0,hypertension
糖尿病引起的脚手麻木怎么办,糖尿病老人注意事项,0,diabetes
肾性高血压的治疗,您好，请问十七、八岁的男孩高血压如何治疗？有肾结石病史,0,hypertension
尿里有一个+号的葡萄糖是糖尿病吗？请帮忙解答！,尿糖有加号是糖尿病吗？,1,diabetes
胰岛素的检测,糖尿病患者早晨空腹测血糖7.7高吗？,0,diabetes
得糖尿病一定要用胰岛素治疗吗,糖尿病人一般什么时间开始使用胰岛素,1,diabetes
男性为什么会得乳腺癌,20岁的男性会得乳腺癌吗，,0,breast_cancer
高血压和贫血的饮食,高血压患者贫血应怎么治疗,1,hypertension
糖尿病脂肪肝的饮食,糖尿病脂肪肝如何饮食,1,diabetes
糖尿病视网膜病变及白内障如何治疗？？？,糖尿病不能用按摩座椅么,0,diabetes
糖尿病能送什么礼物,送糖尿病病人，应该选择哪些补品？,1,diabetes
糖尿病是什么原因产生的,糖尿病肾脏会发生病变吗,0,diabetes
糖尿病人用中医可以治好吗,查尿常规里葡萄糖里有一个加号是糖尿病吗,0,diabetes
慢性乙肝是什么意思,慢性乙肝是怎么回事,1,hepatitis
高血压是怎么引起的？,高血压有什么好的治疗方法吗,1,hypertension
糖尿病全身皮肤瘙痒，吃什么药好,糖尿病患者出现皮肤瘙痒用什么药,1,diabetes
高血压，供血不足应该怎么样调理,高血压吃甚么最好心供血不足眼涩不好睁,1,hypertension
糖尿病人能吃干红枣吗,糖尿病吃大红枣吗,1,diabetes
54岁糖尿病男士精子会孕育吗？,糖尿病会影响精子质量吗,1,diabetes
肛交会传染艾滋病吗,安全套会传染艾滋病吗,0,aids
糖尿病到底可以不吃药吗,糖尿病可以喝咖啡吗，不吃药可以吗,1,diabetes
怀孕十六周血糖5.7，是妊娠糖尿病吗,我患有缺铁性贫血和糖尿病，用什么药补血？,0,diabetes
左肾囊肿是不是高血压引起的？,高血压和肾囊肿有关系吗？中医能治疗肾囊肿吗,1,hypertension
乙肝病毒核酸定量测定为558E02是什么意思,治疗乙肝有哪些方法,0,hepatitis
有糖尿病大脚趾溃烂怎么办？就是大脚趾溃烂,糖尿病脚指烂该如何治疗,1,diabetes
乳腺钙化与乳腺癌是不是一回事,乳腺癌是怎么一回事啊？,0,breast_cancer
艾滋病引起的淋巴肿大吃消炎药管用吗,脖子上的淋巴肿大该怎么办,0,aids
动脉硬化，高血压的根治治疗偏方有吗？动,治疗高血压的一些比较有效的偏方,1,hypertension
糖尿病的饮食帮忙解答下？,糖尿病要少吃哪些食品,1,diabetes
低血糖的人，会不会患有糖尿病呢？,低血糖一定是有糖尿病吗？,1,diabetes
艾滋病病毒在液体高温中能存活多久,艾滋病病毒会在香皂上存活多久、,0,aids
我是小三阳，有糖尿病，高血脂，我该怎么吃药？,糖尿病患者能吃减肥药吗.,0,diabetes
乙肝病毒携带者胃疼怎么办，是什么原因啊,换乙肝大三阳一个多月现在胃疼该怎治疗,1,hepatitis
妊娠糖尿病需要打胰岛素吗,妊辰糖尿病必须打胰岛素吗,1,diabetes
每天吃药就正常，可以怀孕吗,高血压吃药现在正常能否怀孕,1,hypertension
高血压低血压差距大怎么办，高血压压差大怎么办,请问没有高血压的情况下心脏大是什么毛病？,0,hypertension
糖尿病人怎么增胖,你好！糖尿病人平时餐后血糖测试何时为宜？,0,diabetes
糖尿病手指麻木怎么办,妊娠期糖尿病治疗方法,0,diabetes
糖尿病肾病可以治愈吗？,糖尿病早期肾病可以治愈吗,1,diabetes
精液、阴道分泌物能传染艾滋病吗,我闻了精液已经干了的内裤，如果精液上有艾滋病毒，我会被传染吗,1,aids
乳腺癌前期有什么症状,乳腺癌前期是什么症状,1,breast_cancer
乙肝疫苗三针打完没产生抗体可以再加强一针吗,孕妇是乙肝携带者，孩子打完疫苗和,0,hepatitis
你好高血压喝少量的白酒可以吗？就是有的,高血压可以喝黄酒吗,1,hypertension
乳腺癌晚期怎么办,乳腺癌晚期，怎么办？,1,breast_cancer
乳房有肿瘤是不是乳腺癌,乳腺癌肿瘤标志物有哪些？,0,breast_cancer
糖尿病人嗜睡怎么回事,糖耐量试验用83g葡萄糖还是75g葡萄糖,0,diabetes
糖尿病加贫血如何治疗？,用药维持的糖尿病的人能不能怀孕呀,0,diabetes
带安全套和朋友做爱性交会感染艾滋病吗,和朋友做爱得艾滋病的可能性大吗,0,aids
乳腺癌晚期是手术好还是化疗好,乳腺癌应该先化疗还是该手术,0,breast_cancer
高血压血脂稠怎么办啊,48岁，高血压、血脂稠。血脂稠和高血脂,0,hypertension
乙肝大三阳患者和女友性生活会传染吗,乙肝表面抗原阳性证明是已感受染吧，体检,0,hepatitis
艾滋病皮疹痛吗，痒吗有什么症状,这是什么皮疹。不痛不痒。是艾滋病皮,1,aids
你好高血压犯了现在呕吐怎么吧？,高血压，眩晕，呕吐，迷糊咋办呢,1,hypertension
糖尿病多尿的原因生理,女糖尿病人尿频是什么原因？尤其是夜间,1,diabetes
高血压分几级吗,高血压怎么可以根治啊？,0,hypertension
急性的重型乙肝能治愈到和正常人一样吗,性的重型乙肝能治愈到和正常人一样吗,1,hepatitis
0_10_糖尿病不能吃什么食物,处理糖尿病溃烂的处方,0,diabetes
乙肝牙痛能治么,慢性乙肝和牙龈肿痛存在必然关系么,0,hepatitis
乳腺癌晚期有什么症状,乳腺癌症状有什么,0,breast_cancer
糖尿病易出汗吗,糖尿病眼睛爱流泪吗,0,diabetes
乙肝小三阳治疗有什么方法呢,有了抗体还会是乙肝携带者怎么回事,0,hepatitis
糖尿病脚木怎么办,糖尿病人小腿麻木灼热怎么办,1,diabetes
糖尿病跟尿毒症有什么区别？,糖尿病人可以用微波治疗仪吗,0,diabetes
老吃糖会得糖尿病吗,肥胖人群容易得糖尿病吗,1,diabetes
尿酸和糖尿病有关系吗？,糖尿病牙齿松动怎么办？怎么治疗？,0,diabetes
如果感染到了艾滋病，什么时候会出现症状,艾滋病能判断出是什么时候感染的吗,0,aids
经常失眠，耳鸣，还有高血压该看哪科,请问高血压的人能坐飞机吗,0,hypertension
打乙肝疫苗后没有产生抗体该怎么办,我没有打过乙肝疫苗，却有抗体，是怎么回,0,hepatitis
带避孕套会感染艾滋吗,带避孕套性交会感染艾滋病吗,1,aids
糖尿病酮症酸中毒怎样,什么是糖尿病酮症,1,diabetes
糖尿病锻炼可以治愈吗,糖尿病人吃什么不能吃什么,0,diabetes
乳腺癌各个时期的特征是什么,请问得乳腺癌有什么特征,0,breast_cancer
乳腺癌术后淋巴结转移怎么办,乳腺癌术后转移如何治疗,0,breast_cancer
乳腺癌会被误判为乳腺纤维瘤吗,如何区别乳腺癌与乳腺纤维瘤,0,breast_cancer
什么是1型糖尿病？,什么是严重1型糖尿病,1,diabetes
乳腺癌和乳腺增生怎么区别,乳腺癌和乳腺增生有啥子不一样？,1,breast_cancer
糖尿病的如何调节情绪,糖尿病人头晕呕吐是什么原因,0,diabetes
我的检测数值是否可以确定患上了糖尿病,患有脂肪肝、糖尿病的人是否可以吃花生米,0,diabetes
糖尿病吃什么中药最好,中医治疗糖尿病有疗效吗,0,diabetes
乳腺癌肝转移怎么治疗,乳腺癌肝转移的治疗,1,breast_cancer
糖尿病孕妇饮食指引,妊娠糖尿病吃多后血糖升高怎么降,1,diabetes
I型糖尿病会遗传吗,妊娠期糖尿病能不能生孩子,0,diabetes
乙肝表面抗原和表面抗体什么区别,乙肝表面抗原定量的数值大小有什么区别吗谢谢,0,hepatitis
乙肝预苗多少钱,进口乙肝疫苗多少钱,1,hepatitis
打完乙肝疫苗，第二针什么时候打,今年还可以再接种乙肝疫苗加强针吗,0,hepatitis
乙肝大三阳食疗怎么样,乙肝大三阳目前有效治疗方法有哪些,1,hepatitis
乙肝HBVDNA检查结果怎么看,怎么查看乙肝体验HBVDNA结果,1,hepatitis
糖尿病会嘴里发甜吗,有时候感觉嘴里是甜甜的是不是有糖尿病,1,diabetes
玉米须怎样治疗糖尿病,吃南瓜真的不能控制糖尿病吗？我很担心！,0,diabetes
偏方,治疗糖尿病有什么好方法呢？,1,diabetes
高血压呕吐是什么原因该怎么控制？,高血压呕吐的原因,1,hypertension
糖尿病大血管病变可以被完全治好吗？,早期糖尿病能完全治好吗？应如何..,0,diabetes
担心会不会感染艾滋病hiv,现在没什么，只是有点担心，不会感染艾滋病,1,aids
预防艾滋病aids有没有什么好办法,怎么预防艾滋病,1,aids
1型糖尿病能生育吗?,1型糖尿病患者影响生育吗,1,diabetes
高血压患者能不能打甲流疫苗？,男41岁有高血压可以接种甲流疫苗吗,1,hypertension
乙肝的症状有哪些该注意什么,乙肝感染的初期症状有哪些,1,hepatitis
糖尿病并结核病能吃蜂蜜吗,糖尿病能不能喝蜂蜜,1,diabetes
糖化血红蛋白6.1是糖尿病吗,糖化血红蛋白多少算是糖尿病,1,diabetes
乳腺癌骨转移治疗方法,乳腺癌骨转移的病人该如何治疗,1,breast_cancer
舌头上出现白色毛毛还有小红点是艾滋病症状吗,舌头上有毛状白斑感觉是艾滋症状吗,1,aids
乳腺癌已做切除手术后续怎么治疗,乳腺癌切除手术是否需要化疗，,0,breast_cancer
孕妇糖尿病检查前需注意事项,孕期糖耐量检查前一晚上饱食，第二天9点半测试，行吗,1,diabetes
糖尿病人老饿怎么办,糖尿病经常低血糖怎么办？,0,diabetes
糖尿病的人可以吃核桃吗,糖尿病人应怎样锻炼好,0,diabetes
高血压人可以喝醋泡鸡蛋吗,芦荟能治疗高血压吗,0,hypertension
胆红素高有什么后果有什么方法,乙肝患者为什么会胆红素高,0,hepatitis
孕妇产前高血压怎么办,高血压能治好吗？应注意什么？,0,hypertension
急性乙肝是怎么回事,急性乙型肝炎潜伏期后期是什么意思,0,hepatitis
糖尿病上眼皮肿怎么治,糖尿病引起手脚浮肿怎么办,1,diabetes
糖尿病有几种,治疗糖尿病主要是用哪种方式呢？,0,diabetes
早期糖尿病如何治疗和....,检查是否患有糖尿病有哪些项目,0,diabetes
陕西乙肝疫苗多少钱,乙肝疫苗是否免疫成功还需再注射加强疫苗吗,0,hepatitis
高血压能喝蜂蜜吗回答,高血压患者应如何进行运动？,0,hypertension
大三阳可以打乙肝疫苗吗,我家孩子今天打完第二次乙肝疫苗。多久可以吃药,1,hepatitis
口交感染hiv的可能性有多大,口交能感染hiv吗,0,aids
我是糖尿病引起的并发症，烂脚有法治吗？,糖尿病腿上老是痒怎么治疗呢？,0,diabetes
伤口间接接触了艾滋病人的体液、血液、分泌物会被传染吗,没有完全愈合的小伤口接触到艾滋病人没有完全干掉的血液这会导致传染吗,1,aids
糖尿病人发冷是怎么回事,糖尿病人连续发抖、身体发冷是什么原因,1,diabetes
国家提供免费检测HIV服务吗,艾滋病能活多少年求求你告诉我艾滋病免费看吗,0,aids
乙肝五项化验单怎么看HBsAg阳性H,有了乙肝小三阳可以哺乳吗,0,hepatitis
乙肝抗体是怎么回事,什么是乙肝两对半,0,hepatitis
糖尿病人能打甲流疫苗吗？,糖尿病患者能不能打甲流疫苗?,1,diabetes
糖尿病人可以服用伟哥么,高血压糖尿病人吃什么壮阳药,1,diabetes
糖尿病人可以服用伟哥么,妊娠糖尿病可以吃咸菜吗,0,diabetes
糖尿病人能吃裸燕麦属吗,请问糖尿病的人可以吃绿豆面跟燕麦片吗？,1,diabetes
我是糖尿病10年多，原先用30R血糖不稳定，现在改30锐血糖还是高早24，晚20，今早空腹12，2请问我该怎么办。,高血压伴有糖尿病如何用药,0,diabetes
进入更年期后糖尿病高血酸的怎样饮食调节,糖尿病更年期吃什么,1,diabetes
为什么会有糖尿病呢,糖尿病患者为什么会多食？,0,diabetes
痛风高血压能吃枸杞吗,高血压可以喝枸杞黄芪水吗,1,hypertension
妊娠糖尿病可以吃花生吗,妊娠期糖尿病一周食谱,1,diabetes
1型糖尿病能喝酒吗,糖尿病人能吃甜糯米酒吗?,0,diabetes
乳房有肿块是不是乳腺癌,乳房有肿块是不是乳腺疾病乳腺癌？,1,breast_cancer
糖尿病尿蛋白80严重吗怎么治好有效,糖尿病尿蛋白怎办,1,diabetes
这样会感染hiv吗,跪求，这样会不会感染艾滋病,1,aids
乳腺癌前期有什么症状,乳腺癌晚期症状有什么,0,breast_cancer
糖尿病皮肤病是怎么回事啊,糖尿病会引起皮肤病吗,1,diabetes
糖尿病补血食疗法,糖尿病人气血虚亏吃什么好？如何用食补来,0,diabetes
高血压对寿命的影响,40岁以后有了高血压，体重较高，经常有困意，高血压有什么危害吗？农民工工作会有影响吗？,0,hypertension
葡萄糖13是糖尿病吗,空腹葡萄糖8.06是不是糖尿病,1,diabetes
乳腺癌化疗的注意事项是什么,乳腺癌的远处转移的注意事项,0,breast_cancer
乳腺癌骨转移有什么特效药,乳腺癌骨转移后怎么治疗,0,breast_cancer
乳腺癌晚期吃什么中药,乳腺癌晚期吃什么药好？,0,breast_cancer
高血压胃溃疡吃什么药治高血压对胃无害？,高血压胃溃疡应该注意什么？,1,hypertension
在有脂肪肝的期间注射乙肝疫苗有效吗,脂肪肝能打乙肝疫苗吗,1,hepatitis
乙肝带菌者会传染吗,乙肝带菌和小三阳会传染吗,1,hepatitis
乳腺癌早期有可能有哪些症状,乳腺癌早期症状表现有哪些呢,1,breast_cancer
乙肝疫苗第二针应该什么时候打具体天数,我12月26号打的乙肝疫苗，什么时候可,1,hepatitis
糖尿病的症状和引起原因是什么？,为什么会糖尿病,1,diabetes
糖尿病人晚上可以喝牛奶吗,糖尿病人和什么牛奶好,1,diabetes
艾滋病淋巴有什么感觉,艾滋病什么感觉,0,aids
乳腺炎会导致乳腺癌吗,请教乳腺炎会发展成乳腺癌吗,1,breast_cancer
糖尿病是否需要打胰岛素,什么样的糖尿病人必须打胰岛素,1,diabetes
肺结核加糖尿病该怎么办,糖尿病肺结核怎么治,1,diabetes
乳腺癌肿瘤标志物的特点,这乳房里的乳腺癌还是肿瘤还咋办办？,0,breast_cancer
一型糖尿病患者可以吃披萨吗,1型糖尿病吃什么菜好,1,diabetes
您好，请问十七、八岁的男孩高血压如何治疗？有肾结石病史,糖尿病人肾结石高血压压差大怎么治疗？,1,hypertension
我老公乙肝小三阳现在出现关节痛怎麽办,乙肝关节痛怎么办,1,hepatitis
伤口间接接触了艾滋病人的体液、血液、分泌物会被传染吗,我的一只手接触了艾滋病人的血液（当时手没有破）过几天手破了，会感染吗,1,aids
女，38岁，血糖6.36，是糖尿病吗？,单位体检早晨餐前血糖6.2，是糖尿病吗？,1,diabetes
乳腺炎会导致乳腺癌吗,乳腺炎导致乳腺癌的几率大吗,1,breast_cancer
糖尿病嗜睡是怎么回事？怎么解决？,糖尿病酮症酸中毒,0,diabetes
肚子痛是糖尿病的原因吗？,糖尿病患者肚子痛怎嘛回事,1,diabetes
早期糖尿病人吃秋葵可以降糖吗,箭叶秋葵糖尿病人能吃吗,1,diabetes
初期糖尿病需要打胰岛素吗,糖尿病人，在什么情况下适用胰岛素,1,diabetes
乳腺癌肝转移会传染吗,乳腺癌皮肤转移会传染吗,0,breast_cancer
高血压那些饮料不能喝,高血压可以喝哪些饮料,1,hypertension
男性糖尿病人是不是有性功能障碍,糖尿病导致的末梢神经炎并发症该如何预防,0,diabetes
有高血压胆囊炎怎么治疗,有糖尿病，高血压，吃什么要对胆囊炎好,1,hypertension
什么是浸润性乳腺癌,什么是浸润性乳腺癌,1,breast_cancer
经常流鼻血与乙肝相关吗,有乙肝最近流鼻血肝部隐痛是不是得,0,hepatitis
糖尿病人怎样才能长胖,糖尿病会引起体重下降吗？体重下降是不是,1,diabetes
你好我血压是6090怎样能提高血压,怎么样才能提高血压,1,hypertension
乳腺癌脑转移症状有哪些,乳腺癌一般症状有哪些？,0,breast_cancer
乳腺癌如何确定脑转移,乳腺癌脑转移怎么控制？,0,breast_cancer
二型糖尿病病控制好血糖了还用长期服药吗,二型糖尿病是否需要长期吃药,1,diabetes
艾滋病会不会通过蚊子传播,打死了蚊子的血，会传染艾滋病吗,1,aids
乙肝病毒携带者孕妇，DNA是阴性的，必,乙肝病毒DNA参考值（阴性）定量（3,0,hepatitis
二型糖尿病可以像型糖尿病一样手术吗一,2型糖尿病可以用干细胞技术手术吗,1,diabetes
艾滋病能被治愈吗,艾滋病病人得了肠瘘能治愈吗,0,aids
艾滋病应怎样用药,艾滋病药物怎样领取,0,aids
糖尿病人经常熬夜吃什么能补身体？？,糖尿病患者可以吃核桃吗,0,diabetes
为什么会得艾滋病,为什么艾滋病会传染为什么艾滋病会传染为什么艾滋病会传染,0,aids
怎么判断是否患上糖尿病,怎样就能断定是否得了糖尿病？,1,diabetes
我父亲高血压，前几天突然晕倒，请问怎样治疗,患房颤及高血压并发症，应服用哪些药物？,0,hypertension
乳腺癌和乳腺增生怎么区别,乳腺癌与乳腺增生有什么区别,1,breast_cancer
孕妇需要做哪些糖尿病的检查项目呢？我是,孕妇有必要做糖尿病筛查吗,1,diabetes
下午饭前低血糖是糖尿病吗,糖尿病便秘如何治疗?,0,diabetes
糖尿病人适合吃山楂吗,糖尿病如何饮食禁忌？,0,diabetes
乳腺癌脑转移的患者能活多久,乳腺癌还能活多久啊，,0,breast_cancer
尿糖升高有什么表现？,尿糖高尿里有泡沫吗,1,diabetes
